{
  "name": "top-app",
  "version": "1.0.3",
  "source": "git://github.com/monhang/monhang.git?version=v1.0.3",
  "description": "Top-level application",

  "components": [
    {
      "source": "git://github.com/monhang/core.git?version=v1.0.0&type=git",
      "name": "core",
      "description": "Core library component",
      "components": [
        {
          "source": "git://github.com/monhang/utils.git?version=v2.1.0&type=git",
          "name": "utils",
          "description": "Utility functions"
        }
      ]
    },
    {
      "source": "git://github.com/monhang/plugin.git?version=v3.0.1&type=git",
      "name": "plugin",
      "description": "Plugin system"
    }
  ]
}